{
  "approval_boundary": {
    "allowed_next_step": "manual_private_review",
    "artifact_state": "private_draft",
    "authorization_required": true,
    "prohibited_actions": [
      "external_edit",
      "upload",
      "export",
      "share",
      "submit",
      "publish",
      "message",
      "connect",
      "apply",
      "schedule",
      "calendar_create",
      "purchase",
      "enroll"
    ]
  },
  "as_of_date": "2026-08-13",
  "claim_review": [
    {
      "claim_id": "C-001",
      "confidence": "low",
      "decision": "revise",
      "draft_id": null,
      "fact_ids": [
        "F-001",
        "F-002"
      ],
      "requirement_ids": [
        "V-003-R-01"
      ],
      "review_note": "Review the evidence before drafting a claim."
    }
  ],
  "draft_materials": {
    "cv_bullets": [],
    "message_angle": [],
    "recruiter_summary": []
  },
  "first_interview_prep_handoff": {
    "fact_ids": [],
    "interview_stage": "unknown",
    "next_private_step": "Interview preparation remains suppressed.",
    "requirement_ids": [],
    "state": "suppressed",
    "vacancy_id": "V-003"
  },
  "locale": "en",
  "readiness": {
    "blocking_gate_tokens": [],
    "blocking_requirement_ids": [
      "V-003-R-01"
    ],
    "external_action_authorized": false,
    "headline": "Revise before authorization",
    "manual_review_required": true,
    "rationale": "Usable evidence is missing or claims must be revised or omitted before final private review.",
    "revision_claim_ids": [
      "C-001"
    ],
    "state": "revise_first"
  },
  "requirement_evidence": [
    {
      "confidence": "low",
      "coverage": "partial",
      "fact_ids": [
        "F-001",
        "F-002"
      ],
      "priority": "required",
      "requirement_id": "V-003-R-01",
      "signal": "terraform"
    }
  ],
  "schema_version": "private-vacancy-application-packet-v1",
  "source_snapshot": {
    "aggregate": "snap-private-vacancy-packet-sources-v1-sha256-366bcd3658a202e9ab8a6e18eb0742d8c4f8a80a522fbdc469c7248016e163db",
    "candidate_fact_matrix": "snap-candidate-fact-matrix-v1-sha256-49f8ac7929801050233a33cce9ef4df9ddee48deb2e6bd0ef3e5fec170732983",
    "eligibility": "snap-next-action-eligibility-v1-sha256-0d354c24eff1cfbcf37ef5db780ae9707ab73346c9b5cee742674057a41ea347",
    "target_vacancy_research": "snap-market-sha256-54f75316a9266ccd2c46261c4818ac875b0e4d74d669e0eb6397b494a13b866b"
  },
  "target_binding": {
    "eligibility_state": "insufficient_gap_evidence",
    "next_safe_action": "prepare_private_vacancy_packet",
    "organization_label": "Fixture Employer C",
    "vacancy_id": "V-003",
    "vacancy_title": "Fixture DevOps Role C"
  },
  "tracking_proposal": {
    "auto_start": false,
    "event_kind": "application_packet_drafted",
    "manual_reentry_required": true,
    "outcome_state": "draft_only",
    "record_state": "proposed",
    "vacancy_id": "V-003"
  },
  "unsupported_or_missing_claims": [
    {
      "next_private_step": "Review the private evidence and confirm its scope.",
      "reason": "review_required",
      "requirement_id": "V-003-R-01",
      "signal": "terraform"
    }
  ]
}
